{
  "$schema": "https://json-schema.org/draft/2020-12/schema",
  "$id": "urn:td2d:schema:sheet-preset:1",
  "title": "td2d sheet-preset",
  "type": "object",
  "properties": {
    "layout": {
      "type": "string",
      "enum": [
        "grid",
        "strips",
        "packed"
      ],
      "description": "grid: one row per clip and direction, one column per frame. strips: a separate sheet for each clip and direction. packed: sprites packed tightly with the maxrects algorithm."
    },
    "order": {
      "type": "string",
      "enum": [
        "clip-direction",
        "direction-clip"
      ],
      "description": "Sequence order. clip-direction groups the sequences of a clip together; direction-clip groups by direction."
    },
    "flow": {
      "type": "string",
      "enum": [
        "rows",
        "columns"
      ],
      "description": "grid and strips: each clip and direction runs along a row (left to right) or down a column."
    },
    "split": {
      "type": "string",
      "enum": [
        "none",
        "clip",
        "direction"
      ],
      "description": "Make a separate sheet for each clip or each direction. Sheets also split when they would exceed maxSize."
    },
    "trim": {
      "type": "boolean",
      "description": "packed: cut each sprite to its opaque pixels. The offset is recorded so pivots stay correct."
    },
    "padding": {
      "type": "integer",
      "minimum": 0,
      "maximum": 64,
      "description": "Transparent pixels between cells."
    },
    "extrude": {
      "type": "integer",
      "minimum": 0,
      "maximum": 8,
      "description": "Pixels of edge duplication around each cell, for engines that filter textures."
    },
    "powerOfTwo": {
      "type": "boolean",
      "description": "Round sheet sizes up to powers of two."
    },
    "maxSize": {
      "type": "integer",
      "minimum": 64,
      "maximum": 16384,
      "description": "Largest sheet edge in pixels. Larger layouts split into numbered sheets."
    },
    "$schema": {
      "type": "string",
      "description": "Optional JSON Schema reference for editors. Ignored by td2d."
    },
    "schemaVersion": {
      "type": "string",
      "pattern": "^1\\.\\d+\\.\\d+$",
      "description": "Document schema version. Any 1.x.y version is accepted.",
      "examples": [
        "1.0.0"
      ]
    },
    "name": {
      "type": "string",
      "maxLength": 64,
      "pattern": "^[a-z0-9][a-z0-9-]*$",
      "description": "Lowercase kebab-case name.",
      "examples": [
        "steel",
        "endesga-32"
      ]
    },
    "description": {
      "type": "string",
      "maxLength": 2000,
      "description": "Free-text note. Use this instead of comments."
    }
  },
  "required": [
    "schemaVersion",
    "name"
  ],
  "additionalProperties": false,
  "description": "A named set of sheet settings.",
  "examples": [
    {
      "schemaVersion": "1.0.0",
      "name": "atlas-1024",
      "layout": "packed",
      "trim": true,
      "maxSize": 1024
    }
  ]
}
